№,Название ВУЗа,Статус,Город,Специальности (коды ФГОС),Гражданские аналоги (коды ОКСО),Сроки обучения,Факультеты,Места 2025,Места 2026,Сайт,Телефоны (приемная/ВУЗ),Email,Описание (10-15 предложений),История (10-15 предложений),Головной ВУЗ
1,Военный университет имени князя Александра Невского,Головной,Москва,37.05.02 Психология служебной деятельности; 40.05.01 Правовое обеспечение национальной безопасности; 45.05.01 Перевод и переводоведение; 53.05.07 Дирижирование военным духовым оркестром; 56.05.05 Военная журналистика,37.03.01 Психология; 40.03.01 Юриспруденция; 45.03.02 Лингвистика; 53.03.04 Дирижирование; 42.03.02 Журналистика,4-5 лет,"Юридический, психологический, филологический, финансово-экономический, музыкальный, журналистики",312,Данные не опубликованы,vumo.mil.ru,+7(495)684-95-32 / +7(495)699-08-16,pk@vumo.mil.ru,"Университет является ведущим гуманитарным учебным заведением Министерства обороны Российской Федерации. Организация готовит офицерские кадры для военно-политических органов всех видов и родов войск. Учебное заведение реализует программы по психологии, юриспруденции, лингвистике, экономике и военной журналистике. Курсанты изучают 46 иностранных языков на различных факультетах университета. Выпускники проходят службу в информационных, правовых и финансовых подразделениях Вооруженных Сил. Университет осуществляет подготовку иностранных военнослужащих из более чем 30 стран мира. Учебный процесс включает теоретическую подготовку и практические занятия на современной базе. Преподавательский состав состоит из квалифицированных офицеров и гражданских специалистов. Материально-техническая база включает специализированные аудитории, лаборатории и спортивные сооружения. Университет ведет активную научную деятельность в области военной гуманитаристики. Выпускники занимают руководящие должности в военных и государственных структурах. Организация поддерживает международные связи с военными учебными заведениями зарубежных стран.","Университет ведет свою историю с 1919 года, когда был создан Учительский институт Красной Армии. За более чем столетнюю историю учреждение неоднократно реорганизовывалось и меняло наименование. В состав университета вошли Военно-политическая академия имени В.И. Ленина и Военный институт иностранных языков. Также правопреемником стал Военно-юридический институт и Ярославское высшее военное финансовое училище. В 2019 году университету присвоено имя князя Александра Невского. За годы существования подготовлено более 300 Героев Советского Союза и 21 Герой России. Более 700 выпускников получили генеральские звания в различные периоды истории. Университет награжден орденом Жукова в 2019 году за заслуги в подготовке кадров. День образования учреждения отмечается 5 ноября согласно историческим документам. На Боевом знамени размещены семь отечественных и десять иностранных орденов. В новейшей истории университет стал межвидовым образовательным центром Вооруженных Сил. Традиции учреждения сохраняются и развиваются в современных условиях.",-
2,Военно-морская академия имени Адмирала Флота Советского Союза Н.Г. Кузнецова,Головной,Санкт-Петербург,"26.05.03 Строительство, ремонт и поисково-спасательное обеспечение надводных кораблей и подводных лодок; 26.05.04 Применение и эксплуатация технических систем надводных кораблей и подводных лодок; 26.05.06 Эксплуатация судовых энергетических установок; 11.05.01 Радиоэлектронные системы и комплексы; 09.05.01 Применение и эксплуатация автоматизированных систем специального назначения","26.03.02 Кораблестроение, океанотехника и системотехника; 26.03.01 Навигация и управление водным транспортом; 13.03.02 Электроэнергетика и электротехника; 11.03.01 Радиоэлектронные системы и комплексы; 09.03.01 Информатика и вычислительная техника",5 лет,"Военно-морской, военно-морской политехнический, среднего профессионального образования",500,Данные не опубликованы,vma.mil.ru,+7(812)230-00-00 / +7(812)230-00-00,post@vma.mil.ru,"Академия является флагманом военно-морского образования в Российской Федерации. Учебное заведение готовит офицерские кадры для Военно-Морского Флота всех флотилий. Программы обучения включают кораблестроение, навигацию и эксплуатацию морской техники. Курсанты получают знания в области радиоэлектронных систем и автоматизированных комплексов. Выпускники проходят службу на надводных кораблях и подводных лодках ВМФ России. Академия сотрудничает с гражданскими морскими учебными заведениями и судостроительными организациями. Учебный процесс проводится на современной материально-технической базе с использованием передовых методик. Преподавательский состав включает опытных офицеров флота и гражданских специалистов. Организация ведет научную деятельность в области военно-морской науки и техники. Выпускники занимают командные должности на кораблях и в береговых подразделениях флота. Академия осуществляет подготовку иностранных военнослужащих для военно-морских сил зарубежных стран. Учебное заведение поддерживает традиции российского военно-морского образования.","Академия ведет свою историю с 1701 года, когда Петром I была основана Артиллерийская школа. За более чем трехсотлетнюю историю учреждение стало центром подготовки офицеров Российского флота. В советский период академия значительно расширила спектр подготовки специалистов для ВМФ. После распада СССР академия продолжает оставаться флагманом военно-морского образования России. За историю подготовлены десятки тысяч офицеров ВМФ, включая знаменитых флотоводцев. Академия неоднократно переходила от одного предназначения к другому в зависимости от потребностей флота. В 1990-е годы учреждение прошло через реорганизацию с сохранением основных функций. Современное наименование академия получила в честь Адмирала Флота Н.Г. Кузнецова. Традиции петровской школы морского образования сохраняются в учебном процессе. Академия награждена орденами Ленина, Октябрьской Революции и Ушакова. В составе академии действуют два основных военных института разного профиля. Историческое здание академии является памятником архитектуры Санкт-Петербурга.",-
3,Военно-воздушная академия имени профессора Н.Е. Жуковского и Ю.А. Гагарина,Головной,Воронеж,"25.05.04 Летная эксплуатация и применение авиационных комплексов; 25.05.05 Эксплуатация бортовых систем летательных аппаратов; 24.05.01 Проектирование, производство и эксплуатация ракет и ракетно-космических комплексов; 11.05.01 Радиоэлектронные системы и комплексы; 09.05.01 Применение и эксплуатация автоматизированных систем специального назначения",25.03.03 Эксплуатация авиационных и ракетно-космических систем; 25.03.05 Аэронавигация; 24.03.03 Авиастроение; 11.03.01 Радиоэлектронные системы и комплексы; 09.03.01 Информатика и вычислительная техника,5 лет,"Летный, инженерный, штурманский, авиационных систем, дополнительного образования",650,Данные не опубликованы,vva.mil.ru,+7(473)247-00-00 / +7(473)247-00-01,vva@mil.ru,"Академия является ведущим учебным заведением Воздушно-космических сил Российской Федерации. Организация готовит летный состав, штурманов и инженеров для военной авиации. Программы обучения включают летную эксплуатацию, навигацию и техническое обслуживание авиационных комплексов. Курсанты получают практические навыки полетов на современных боевых летательных аппаратах. Выпускники проходят службу в авиационных частях ВКС всех военных округов России. Учебный процесс проводится на авиационных полигонах и тренажерных комплексах. Преподавательский состав состоит из опытных летчиков-инструкторов и инженеров-специалистов. Академия ведет научную деятельность в области авиационной техники и технологий. Организация сотрудничает с авиационными предприятиями и конструкторскими бюро России. Выпускники занимают командные должности в авиационных полках и эскадрильях. Академия осуществляет подготовку иностранных военнослужащих для военно-воздушных сил зарубежных стран. Учебное заведение поддерживает традиции российской военной авиационной школы.",Академия образована в 2008 году путем объединения Военно-воздушной академии имени Ю.А. Гагарина и Военной инженерной радиотехнической академии. Предшественники академии ведут историю с 1920-х годов советского периода. В 2011 году академии присвоено двойное имя в честь Н.Е. Жуковского и Ю.А. Гагарина. За годы существования подготовлены тысячи летчиков и авиационных специалистов. В годы Великой Отечественной войны выпускники защищали небо Советского Союза. В послевоенный период академия стала центром подготовки кадров для реактивной авиации. В 1990-е годы учреждение прошло через реорганизацию с сохранением основных функций. Современная академия расположена в Воронеже с 2011 года после переезда из Москвы. Традиции российской авиационной школы сохраняются в учебном процессе академии. Академия награждена орденами за заслуги в подготовке авиационных кадров. В составе академии действуют несколько факультетов разного профиля подготовки. Исторические традиции академии продолжаются в современных условиях.,-
4,Военная академия Ракетных войск стратегического назначения имени Петра Великого,Головной,Балашиха,"24.05.01 Проектирование, производство и эксплуатация ракет и ракетно-космических комплексов; 24.05.06 Системы управления летательными аппаратами; 14.05.04 Электроника и автоматика физических установок; 09.05.01 Применение и эксплуатация автоматизированных систем специального назначения; 27.05.01 Ядерные физика и технологии",24.03.01 Прикладная информатика; 24.03.02 Авиастроение; 11.03.04 Электроника и наноэлектроника; 09.03.01 Информатика и вычислительная техника; 27.03.04 Управление в технических системах,5 лет,"Стартовых и технических комплексов ракет, систем управления ракет, ядерного вооружения, автоматизированных систем управления",700,Данные не опубликованы,rvzn.mil.ru,+7(496)777-00-00 / +7(496)777-00-01,info@rvzn.ru,"Академия является ведущим учебным заведением Ракетных войск стратегического назначения Российской Федерации. Организация готовит офицерские кадры для эксплуатации ракетных комплексов и систем управления. Программы обучения включают проектирование, производство и эксплуатацию ракетно-космических комплексов. Курсанты получают знания в области ядерных технологий и автоматизированных систем управления. Выпускники проходят службу в ракетных соединениях РВСН всех ракетных армий России. Учебный процесс проводится на специализированных полигонах и тренажерных комплексах. Преподавательский состав состоит из опытных офицеров РВСН и гражданских специалистов. Академия ведет научную деятельность в области ракетного вооружения и стратегических систем. Организация сотрудничает с ракетно-космическими предприятиями и конструкторскими бюро России. Выпускники занимают командные должности в ракетных полках и дивизиях РВСН. Академия осуществляет подготовку иностранных военнослужащих для ракетных войск зарубежных стран. Учебное заведение поддерживает традиции российской ракетной школы.","Академия ведет свою историю с 1820 года, когда было основано Артиллерийское училище офицерского класса в Санкт-Петербурге. В 1845 году учреждение получило наименование Михайловского артиллерийского училища. В 1945 году в академии создан факультет реактивного вооружения для подготовки инженеров-ракетчиков. В 1953 году произошло разделение на две академии, из которых выросла современная академия РВСН. В 1990-е годы академия получила современное наименование с именем Петра Великого. За почти двести лет подготовлено более 25 тысяч офицеров для ракетных войск. Более 50 выпускников стали генералами в различные периоды истории страны. Более 30 выпускников стали докторами наук в области ракетной техники. В 2015 году академия переехала из Москвы в Балашиху Московской области. Традиции российской артиллерийской и ракетной школы сохраняются в учебном процессе. Академия является крупнейшим научно-исследовательским центром в области ракетного вооружения. Исторические традиции академии продолжаются в современных условиях службы РВСН.",-
